[
  {
    "id": 2,
    "שם הקובץ": "for moshe rib 83",
    "תאריך יצירה": "2025-08-16 16:07:14",
    "מוצרים": [
      {
        "שם המוצר": "בגד גוף גופייה",
        "מידות": [
          {
            "מידה": "0-3",
            "כמות": 1,
            "הערה": "רגיל"
          },
          {
            "מידה": "12-18",
            "כמות": 1,
            "הערה": "רגיל"
          },
          {
            "מידה": "18-24",
            "כמות": 1,
            "הערה": "רגיל"
          }
        ]
      },
      {
        "שם המוצר": "בגד גוף קצר",
        "מידות": [
          {
            "מידה": "6-12",
            "כמות": 1,
            "הערה": "רגיל"
          }
        ]
      }
    ],
    "סך כמויות": 4,
    "status": "נחתך",
    "סוג בד": "טריקו לבן",
    "נמען": "אלשראר מסחר ותעשייה בע\"מ",
    "נשלח לספק": true,
    "שכבות": 80
  },
  {
    "id": 5,
    "שם הקובץ": "OVERALL 0-3 baby and children",
    "תאריך יצירה": "2025-08-19 12:34:49",
    "מוצרים": [
      {
        "שם המוצר": "אוברול",
        "מידות": [
          {
            "מידה": "0-3",
            "כמות": 1,
            "הערה": "רגיל"
          },
          {
            "מידה": "3-6",
            "כמות": 1,
            "הערה": "רגיל"
          },
          {
            "מידה": "6-12",
            "כמות": 1,
            "הערה": "רגיל"
          }
        ]
      },
      {
        "שם המוצר": "בגד גוף צווארון אמריקאי",
        "מידות": [
          {
            "מידה": "0-3",
            "כמות": 1,
            "הערה": "רגיל"
          },
          {
            "מידה": "12-18",
            "כמות": 1,
            "הערה": "רגיל"
          },
          {
            "מידה": "3-6",
            "כמות": 1,
            "הערה": "רגיל"
          },
          {
            "מידה": "6-12",
            "כמות": 1,
            "הערה": "רגיל"
          }
        ]
      },
      {
        "שם המוצר": "חולצת ילדים ש.א מולי 25\\26",
        "מידות": [
          {
            "מידה": "2",
            "כמות": 1,
            "הערה": "רגיל"
          },
          {
            "מידה": "4",
            "כמות": 1,
            "הערה": "רגיל"
          },
          {
            "מידה": "6",
            "כמות": 1,
            "הערה": "רגיל"
          },
          {
            "מידה": "18-24",
            "כמות": 1,
            "הערה": "רגיל"
          }
        ]
      },
      {
        "שם המוצר": "מכנס ארוך מולי ילדים חורף 25-26",
        "מידות": [
          {
            "מידה": "2",
            "כמות": 1,
            "הערה": "רגיל"
          },
          {
            "מידה": "4",
            "כמות": 1,
            "הערה": "רגיל"
          },
          {
            "מידה": "6",
            "כמות": 1,
            "הערה": "רגיל"
          }
        ]
      },
      {
        "שם המוצר": "מכנס תינוק מולי חורף 25-26",
        "מידות": [
          {
            "מידה": "0-3",
            "כמות": 1,
            "הערה": "רגיל"
          },
          {
            "מידה": "3-6",
            "כמות": 1,
            "הערה": "רגיל"
          },
          {
            "מידה": "6-12",
            "כמות": 1,
            "הערה": "רגיל"
          },
          {
            "מידה": "12-18",
            "כמות": 1,
            "הערה": "רגיל"
          },
          {
            "מידה": "18-24",
            "כמות": 1,
            "הערה": "רגיל"
          }
        ]
      }
    ],
    "סך כמויות": 19,
    "status": "נשלח",
    "סוג בד": "פלנל מודפס",
    "נמען": "אלשראר מסחר ותעשייה בע\"מ",
    "נשלח לספק": true
  },
  {
    "id": 6,
    "שם הקובץ": "25-01 dress singel fabric (7)",
    "תאריך יצירה": "2025-08-19 13:19:13",
    "מוצרים": [
      {
        "שם המוצר": "שמלה ש.א מולי25-26",
        "מידות": [
          {
            "מידה": "2",
            "כמות": 1,
            "הערה": "רגיל"
          },
          {
            "מידה": "4",
            "כמות": 1,
            "הערה": "רגיל"
          },
          {
            "מידה": "6",
            "כמות": 1,
            "הערה": "רגיל"
          },
          {
            "מידה": "8",
            "כמות": 1,
            "הערה": "רגיל"
          }
        ]
      }
    ],
    "סך כמויות": 4,
    "status": "נשלח",
    "סוג בד": "פלנל מודפס",
    "נמען": "אלשראר מסחר ותעשייה בע\"מ",
    "נשלח לספק": true
  },
  {
    "id": 7,
    "שם הקובץ": "026  Baby bodysuit short sleeve 6-12 82",
    "תאריך יצירה": "2025-08-20 10:16:50",
    "מוצרים": [
      {
        "שם המוצר": "בגד גוף קצר",
        "מידות": [
          {
            "מידה": "6-12",
            "כמות": 2,
            "הערה": "רגיל"
          }
        ]
      }
    ],
    "סך כמויות": 2,
    "status": "נשלח",
    "סוג בד": "טריקו לבן",
    "נמען": "אריה",
    "נשלח לספק": true
  },
  {
    "id": 9,
    "שם הקובץ": "interlouck for maged",
    "תאריך יצירה": "2025-09-02 13:55:20",
    "מוצרים": [
      {
        "שם המוצר": "בגד גוף מעטפת",
        "מידות": [
          {
            "מידה": "0-3",
            "כמות": 5,
            "הערה": "חולק ב-2 (Tubular)"
          }
        ]
      },
      {
        "שם המוצר": "גופיות פלנל",
        "מידות": [
          {
            "מידה": "2",
            "כמות": 1,
            "הערה": "חולק ב-2 (Tubular)"
          },
          {
            "מידה": "4",
            "כמות": 3,
            "הערה": "חולק ב-2 (Tubular)"
          },
          {
            "מידה": "8",
            "כמות": 2,
            "הערה": "חולק ב-2 (Tubular)"
          }
        ]
      },
      {
        "שם המוצר": "רגליות",
        "מידות": [
          {
            "מידה": "0-3",
            "כמות": 4,
            "הערה": "רגיל"
          }
        ]
      }
    ],
    "סך כמויות": 15,
    "status": "נחתך",
    "סוג בד": "פלנל לבן",
    "נמען": "אלשראר מסחר ותעשייה בע\"מ",
    "נשלח לספק": true,
    "שכבות": 138,
    "משקל כולל": 253.25000000000003,
    "מטרים כוללים": 692.73
  },
  {
    "id": 10,
    "שם הקובץ": "swagey",
    "תאריך יצירה": "2025-09-07 11:29:46",
    "מוצרים": [
      {
        "שם המוצר": "אוברול ארוך סואגי",
        "מידות": [
          {
            "מידה": "0-3",
            "כמות": 2,
            "הערה": "רגיל"
          },
          {
            "מידה": "12-18",
            "כמות": 1,
            "הערה": "רגיל"
          },
          {
            "מידה": "3-6",
            "כמות": 2,
            "הערה": "רגיל"
          },
          {
            "מידה": "6-12",
            "כמות": 1,
            "הערה": "רגיל"
          }
        ]
      }
    ],
    "סך כמויות": 6,
    "status": "נחתך",
    "סוג בד": "פלנל לבן",
    "נמען": "אלשראר מסחר ותעשייה בע\"מ",
    "נשלח לספק": true,
    "כמות שכבות משוערת": 90,
    "רוחב ציור": 87.0,
    "אורך ציור": 349.16041564941406,
    "שכבות": 188,
    "משקל כולל": 122.14999999999999,
    "מטרים כוללים": 328.38
  },
  {
    "id": 11,
    "שם הקובץ": "moshe winter",
    "תאריך יצירה": "2025-09-09 10:19:50",
    "מוצרים": [
      {
        "שם המוצר": "בגד גוף ש.א",
        "מידות": [
          {
            "מידה": "3-6",
            "כמות": 1,
            "הערה": "חולק ב-2 (Tubular)"
          },
          {
            "מידה": "6-12",
            "כמות": 1,
            "הערה": "חולק ב-2 (Tubular)"
          },
          {
            "מידה": "18-24",
            "כמות": 2,
            "הערה": "חולק ב-2 (Tubular)"
          }
        ]
      },
      {
        "שם המוצר": "חזיה טיק טק",
        "מידות": [
          {
            "מידה": "0-3",
            "כמות": 1,
            "הערה": "חולק ב-2 (Tubular)"
          }
        ]
      }
    ],
    "סך כמויות": 5,
    "status": "נחתך",
    "סוג בד": "פלנל לבן",
    "נמען": "אריה",
    "נשלח לספק": true,
    "כמות שכבות משוערת": 200,
    "רוחב ציור": 83.0,
    "אורך ציור": 220.95699863057723,
    "שכבות": 164
  },
  {
    "id": 12,
    "שם הקובץ": "for maged 14.09.2025",
    "תאריך יצירה": "2025-09-14 20:55:31",
    "מוצרים": [
      {
        "שם המוצר": "בגד גוף מעטפת",
        "מידות": [
          {
            "מידה": "0-3",
            "כמות": 2,
            "הערה": "חולק ב-2 (Tubular)"
          }
        ]
      },
      {
        "שם המוצר": "בגד גוף ש.א",
        "מידות": [
          {
            "מידה": "3-6",
            "כמות": 3,
            "הערה": "חולק ב-2 (Tubular)"
          },
          {
            "מידה": "6-12",
            "כמות": 3,
            "הערה": "חולק ב-2 (Tubular)"
          },
          {
            "מידה": "12-18",
            "כמות": 3,
            "הערה": "חולק ב-2 (Tubular)"
          },
          {
            "מידה": "18-24",
            "כמות": 3,
            "הערה": "חולק ב-2 (Tubular)"
          },
          {
            "מידה": "24-30",
            "כמות": 2,
            "הערה": "חולק ב-2 (Tubular)"
          }
        ]
      },
      {
        "שם המוצר": "רגליות",
        "מידות": [
          {
            "מידה": "0-3",
            "כמות": 2,
            "הערה": "רגיל"
          },
          {
            "מידה": "12-18",
            "כמות": 2,
            "הערה": "רגיל"
          }
        ]
      }
    ],
    "סך כמויות": 20,
    "status": "נחתך",
    "סוג בד": "פלנל לבן",
    "נמען": "אלשראר מסחר ותעשייה בע\"מ",
    "נשלח לספק": true,
    "כמות שכבות משוערת": 200,
    "רוחב ציור": 84.0,
    "אורך ציור": 866.8383152899521,
    "שכבות": 204,
    "משקל כולל": 385.55,
    "מטרים כוללים": 1055.44
  },
  {
    "id": 13,
    "שם הקובץ": "for maged 15.09.2025",
    "תאריך יצירה": "2025-09-15 12:35:48",
    "מוצרים": [
      {
        "שם המוצר": "בגד גוף מעטפת",
        "מידות": [
          {
            "מידה": "0-3",
            "כמות": 4,
            "הערה": "חולק ב-2 (Tubular)"
          }
        ]
      },
      {
        "שם המוצר": "גטקס",
        "מידות": [
          {
            "מידה": "12-18",
            "כמות": 4,
            "הערה": "חולק ב-2 (Tubular)"
          },
          {
            "מידה": "18-24",
            "כמות": 4,
            "הערה": "חולק ב-2 (Tubular)"
          },
          {
            "מידה": "24-30",
            "כמות": 4,
            "הערה": "חולק ב-2 (Tubular)"
          },
          {
            "מידה": "3-6",
            "כמות": 1,
            "הערה": "חולק ב-2 (Tubular)"
          },
          {
            "מידה": "6-12",
            "כמות": 1,
            "הערה": "חולק ב-2 (Tubular)"
          }
        ]
      },
      {
        "שם המוצר": "רגליות",
        "מידות": [
          {
            "מידה": "0-3",
            "כמות": 4,
            "הערה": "רגיל"
          }
        ]
      }
    ],
    "סך כמויות": 22,
    "status": "נחתך",
    "סוג בד": "פלנל לבן",
    "נמען": "אלשראר מסחר ותעשייה בע\"מ",
    "נשלח לספק": true,
    "כמות שכבות משוערת": 200,
    "רוחב ציור": 84.0,
    "אורך ציור": 812.5107383686799,
    "שכבות": 214,
    "משקל כולל": 368.05000000000007,
    "מטרים כוללים": 1010.6099999999999
  },
  {
    "id": 14,
    "שם הקובץ": "arye interlouck 16.09.2025 87 cm",
    "תאריך יצירה": "2025-09-16 11:34:38",
    "מוצרים": [
      {
        "שם המוצר": "גופיות פלנל",
        "מידות": [
          {
            "מידה": "4",
            "כמות": 2,
            "הערה": "חולק ב-2 (Tubular)"
          },
          {
            "מידה": "6",
            "כמות": 2,
            "הערה": "חולק ב-2 (Tubular)"
          }
        ]
      }
    ],
    "סך כמויות": 4,
    "status": "נחתך",
    "סוג בד": "פלנל לבן",
    "נמען": "אריה",
    "נשלח לספק": true,
    "כמות שכבות משוערת": 200,
    "רוחב ציור": 87.0,
    "אורך ציור": 242.64493462955903,
    "שכבות": 212,
    "משקל כולל": 102.9,
    "מטרים כוללים": 257.79
  },
  {
    "id": 15,
    "שם הקובץ": "for moshe 18.09.2025 iterlouck 89",
    "תאריך יצירה": "2025-09-18 12:11:48",
    "מוצרים": [
      {
        "שם המוצר": "גופיות פלנל",
        "מידות": [
          {
            "מידה": "2",
            "כמות": 1,
            "הערה": "חולק ב-2 (Tubular)"
          },
          {
            "מידה": "10",
            "כמות": 1,
            "הערה": "חולק ב-2 (Tubular)"
          }
        ]
      },
      {
        "שם המוצר": "חולצת בייבי",
        "מידות": [
          {
            "מידה": "18m-24m",
            "כמות": 2,
            "הערה": "חולק ב-2 (Tubular)"
          }
        ]
      },
      {
        "שם המוצר": "חזיה טיק טק",
        "מידות": [
          {
            "מידה": "0-3m",
            "כמות": 1,
            "הערה": "חולק ב-2 (Tubular)"
          }
        ]
      }
    ],
    "סך כמויות": 5,
    "status": "נחתך",
    "סוג בד": "פלנל לבן",
    "נמען": "אריה",
    "נשלח לספק": true,
    "כמות שכבות משוערת": 200,
    "רוחב ציור": 89.0,
    "אורך ציור": 250.67755055780287,
    "שכבות": 220,
    "משקל כולל": 85.94999999999999,
    "מטרים כוללים": 230.37
  },
  {
    "id": 16,
    "שם הקובץ": "for maged 25.09.2025",
    "תאריך יצירה": "2025-09-25 12:32:10",
    "מוצרים": [
      {
        "שם המוצר": "בגד גוף ש.א",
        "מידות": [
          {
            "מידה": "0-3",
            "כמות": 2,
            "הערה": "חולק ב-2 (Tubular)"
          }
        ]
      },
      {
        "שם המוצר": "גופיות פלנל",
        "מידות": [
          {
            "מידה": "10",
            "כמות": 2,
            "הערה": "חולק ב-2 (Tubular)"
          },
          {
            "מידה": "12",
            "כמות": 2,
            "הערה": "חולק ב-2 (Tubular)"
          },
          {
            "מידה": "14",
            "כמות": 1,
            "הערה": "חולק ב-2 (Tubular)"
          },
          {
            "מידה": "16",
            "כמות": 1,
            "הערה": "חולק ב-2 (Tubular)"
          }
        ]
      },
      {
        "שם המוצר": "חולצת בייבי",
        "מידות": [
          {
            "מידה": "12m-18m",
            "כמות": 2,
            "הערה": "חולק ב-2 (Tubular)"
          },
          {
            "מידה": "18m-24m",
            "כמות": 1,
            "הערה": "חולק ב-2 (Tubular)"
          },
          {
            "מידה": "6m-12m",
            "כמות": 1,
            "הערה": "חולק ב-2 (Tubular)"
          }
        ]
      },
      {
        "שם המוצר": "רגליות",
        "מידות": [
          {
            "מידה": "3-6",
            "כמות": 2,
            "הערה": "רגיל"
          }
        ]
      }
    ],
    "סך כמויות": 14,
    "status": "נחתך",
    "סוג בד": "פלנל לבן",
    "נמען": "אלשראר מסחר ותעשייה בע\"מ",
    "נשלח לספק": true,
    "כמות שכבות משוערת": 200,
    "רוחב ציור": 86.0,
    "אורך ציור": 893.4917773250336,
    "שכבות": 204,
    "משקל כולל": 309.45000000000005,
    "מטרים כוללים": 830.2500000000001
  },
  {
    "id": 17,
    "שם הקובץ": "OVERALL 0-3 for maged 86 25.09.2025",
    "תאריך יצירה": "2025-09-25 13:29:02",
    "מוצרים": [
      {
        "שם המוצר": "אוברול",
        "מידות": [
          {
            "מידה": "0-3",
            "כמות": 2,
            "הערה": "רגיל"
          }
        ]
      }
    ],
    "סך כמויות": 2,
    "status": "נחתך",
    "סוג בד": "פלנל לבן",
    "נמען": "אלשראר מסחר ותעשייה בע\"מ",
    "נשלח לספק": true,
    "כמות שכבות משוערת": 100,
    "רוחב ציור": 86.0,
    "אורך ציור": 119.54913213470044,
    "שכבות": 104,
    "משקל כולל": 24.3,
    "מטרים כוללים": 65.13
  },
  {
    "id": 18,
    "שם הקובץ": "for moshe rib 25.09.2025",
    "תאריך יצירה": "2025-09-25 14:51:10",
    "מוצרים": [
      {
        "שם המוצר": "אוברול",
        "מידות": [
          {
            "מידה": "0-3",
            "כמות": 1,
            "הערה": "חולק ב-2 (Tubular)"
          }
        ]
      },
      {
        "שם המוצר": "בגד גוף גופייה",
        "מידות": [
          {
            "מידה": "0-3",
            "כמות": 1,
            "הערה": "חולק ב-2 (Tubular)"
          },
          {
            "מידה": "3-6",
            "כמות": 1,
            "הערה": "חולק ב-2 (Tubular)"
          },
          {
            "מידה": "6-12",
            "כמות": 1,
            "הערה": "חולק ב-2 (Tubular)"
          },
          {
            "מידה": "12-18",
            "כמות": 1,
            "הערה": "חולק ב-2 (Tubular)"
          },
          {
            "מידה": "18-24",
            "כמות": 1,
            "הערה": "חולק ב-2 (Tubular)"
          },
          {
            "מידה": "24-30",
            "כמות": 1,
            "הערה": "חולק ב-2 (Tubular)"
          }
        ]
      },
      {
        "שם המוצר": "גופוית פלנל",
        "מידות": [
          {
            "מידה": "2",
            "כמות": 1,
            "הערה": "חולק ב-2 (Tubular)"
          },
          {
            "מידה": "4",
            "כמות": 2,
            "הערה": "חולק ב-2 (Tubular)"
          },
          {
            "מידה": "6",
            "כמות": 2,
            "הערה": "חולק ב-2 (Tubular)"
          },
          {
            "מידה": "10",
            "כמות": 1,
            "הערה": "חולק ב-2 (Tubular)"
          }
        ]
      }
    ],
    "סך כמויות": 13,
    "status": "נחתך",
    "סוג בד": "פלנל לבן",
    "נמען": "אריה",
    "נשלח לספק": true,
    "כמות שכבות משוערת": 100,
    "רוחב ציור": 85.0,
    "אורך ציור": 259.6443377223002,
    "שכבות": 242,
    "משקל כולל": 97.0,
    "מטרים כוללים": 316.99
  },
  {
    "id": 19,
    "שם הקובץ": "for maged 28.09.25 set leggings + kimono",
    "תאריך יצירה": "2025-09-28 12:03:14",
    "מוצרים": [
      {
        "שם המוצר": "בגד גוף מעטפת",
        "מידות": [
          {
            "מידה": "0-3m",
            "כמות": 3,
            "הערה": "רגיל"
          }
        ]
      },
      {
        "שם המוצר": "רגליות",
        "מידות": [
          {
            "מידה": "0-3",
            "כמות": 3,
            "הערה": "רגיל"
          }
        ]
      }
    ],
    "סך כמויות": 6,
    "status": "נשלח",
    "סוג בד": "פלנל מודפס",
    "נמען": "אלשראר מסחר ותעשייה בע\"מ",
    "נשלח לספק": true,
    "כמות שכבות משוערת": 200,
    "רוחב ציור": 153.0,
    "אורך ציור": 111.62484290517764
  },
  {
    "id": 20,
    "שם הקובץ": "for maged 16.10.2025",
    "תאריך יצירה": "2025-10-16 12:50:25",
    "מוצרים": [
      {
        "שם המוצר": "בגד גוף מעטפת",
        "מידות": [
          {
            "מידה": "0-3",
            "כמות": 1,
            "הערה": "חולק ב-2 (Tubular)"
          }
        ]
      },
      {
        "שם המוצר": "בגד גוף ש.א",
        "מידות": [
          {
            "מידה": "0-3",
            "כמות": 2,
            "הערה": "חולק ב-2 (Tubular)"
          },
          {
            "מידה": "3-6",
            "כמות": 4,
            "הערה": "חולק ב-2 (Tubular)"
          },
          {
            "מידה": "6-12",
            "כמות": 4,
            "הערה": "חולק ב-2 (Tubular)"
          },
          {
            "מידה": "12-18",
            "כמות": 3,
            "הערה": "חולק ב-2 (Tubular)"
          },
          {
            "מידה": "18-24",
            "כמות": 3,
            "הערה": "חולק ב-2 (Tubular)"
          },
          {
            "מידה": "24-30",
            "כמות": 3,
            "הערה": "חולק ב-2 (Tubular)"
          }
        ]
      }
    ],
    "סך כמויות": 20,
    "status": "נחתך",
    "סוג בד": "פלנל לבן",
    "נמען": "אלשראר מסחר ותעשייה בע\"מ",
    "נשלח לספק": true,
    "כמות שכבות משוערת": 200,
    "רוחב ציור": 86.0,
    "אורך ציור": 890.6019080671256,
    "שכבות": 201,
    "משקל כולל": 345.70000000000005,
    "מטרים כוללים": 927.64
  },
  {
    "id": 21,
    "שם הקובץ": "moshe 19.10.2025",
    "תאריך יצירה": "2025-10-19 11:05:21",
    "מוצרים": [
      {
        "שם המוצר": "גופיות פלנל",
        "מידות": [
          {
            "מידה": "4",
            "כמות": 2,
            "הערה": "חולק ב-2 (Tubular)"
          },
          {
            "מידה": "6",
            "כמות": 2,
            "הערה": "חולק ב-2 (Tubular)"
          }
        ]
      }
    ],
    "סך כמויות": 4,
    "status": "נחתך",
    "סוג בד": "פלנל לבן",
    "נמען": "אריה",
    "נשלח לספק": true,
    "כמות שכבות משוערת": 200,
    "רוחב ציור": 89.0,
    "אורך ציור": 252.33760362417516,
    "שכבות": 228,
    "משקל כולל": 113.35,
    "מטרים כוללים": 303.8
  },
  {
    "id": 22,
    "שם הקובץ": "for maged 20.10.25",
    "תאריך יצירה": "2025-10-20 13:03:53",
    "מוצרים": [
      {
        "שם המוצר": "גטקס",
        "מידות": [
          {
            "מידה": "12m-18m",
            "כמות": 3,
            "הערה": "חולק ב-2 (Tubular)"
          },
          {
            "מידה": "18m-24m",
            "כמות": 3,
            "הערה": "חולק ב-2 (Tubular)"
          },
          {
            "מידה": "24m-30m",
            "כמות": 3,
            "הערה": "חולק ב-2 (Tubular)"
          },
          {
            "מידה": "6m-12m",
            "כמות": 1,
            "הערה": "חולק ב-2 (Tubular)"
          }
        ]
      }
    ],
    "סך כמויות": 10,
    "status": "נחתך",
    "סוג בד": "פלנל לבן",
    "נמען": "אלשראר מסחר ותעשייה בע\"מ",
    "נשלח לספק": true,
    "כמות שכבות משוערת": 200,
    "רוחב ציור": 86.0,
    "אורך ציור": 397.77474895876423,
    "שכבות": 212,
    "משקל כולל": 166.6,
    "מטרים כוללים": 446.53
  },
  {
    "id": 23,
    "שם הקובץ": "moshe 128.10 interlouck 89",
    "תאריך יצירה": "2025-10-28 13:10:02",
    "מוצרים": [
      {
        "שם המוצר": "גופיות פלנל",
        "מידות": [
          {
            "מידה": "4",
            "כמות": 1,
            "הערה": "חולק ב-2 (Tubular)"
          },
          {
            "מידה": "6",
            "כמות": 2,
            "הערה": "חולק ב-2 (Tubular)"
          },
          {
            "מידה": "8",
            "כמות": 1,
            "הערה": "חולק ב-2 (Tubular)"
          }
        ]
      }
    ],
    "סך כמויות": 4,
    "status": "נחתך",
    "סוג בד": "טריקו לבן",
    "נמען": "אריה",
    "נשלח לספק": true,
    "כמות שכבות משוערת": 200,
    "רוחב ציור": 89.0,
    "אורך ציור": 263.59861745203375,
    "שכבות": 248,
    "משקל כולל": 126.80000000000001,
    "מטרים כוללים": 339.84999999999997
  },
  {
    "id": 24,
    "שם הקובץ": "for maged 10.11.25",
    "תאריך יצירה": "2025-11-10 09:04:15",
    "מוצרים": [
      {
        "שם המוצר": "בגד גוף ש.א",
        "מידות": [
          {
            "מידה": "0-3",
            "כמות": 2,
            "הערה": "חולק ב-2 (Tubular)"
          },
          {
            "מידה": "3-6",
            "כמות": 3,
            "הערה": "חולק ב-2 (Tubular)"
          }
        ]
      },
      {
        "שם המוצר": "גופיות פלנל",
        "מידות": [
          {
            "מידה": "2",
            "כמות": 3,
            "הערה": "חולק ב-2 (Tubular)"
          }
        ]
      },
      {
        "שם המוצר": "רגליות",
        "מידות": [
          {
            "מידה": "0-3",
            "כמות": 4,
            "הערה": "רגיל"
          },
          {
            "מידה": "3-6",
            "כמות": 2,
            "הערה": "רגיל"
          },
          {
            "מידה": "18-24",
            "כמות": 2,
            "הערה": "רגיל"
          }
        ]
      }
    ],
    "סך כמויות": 16,
    "status": "נחתך",
    "סוג בד": "פלנל לבן",
    "נמען": "אלשראר מסחר ותעשייה בע\"מ",
    "נשלח לספק": true,
    "כמות שכבות משוערת": 200,
    "רוחב ציור": 86.0,
    "אורך ציור": 568.2752838852418,
    "שכבות": 206,
    "משקל כולל": 229.99999999999997,
    "מטרים כוללים": 616.9300000000001
  },
  {
    "id": 25,
    "שם הקובץ": "for rib moshe 85.11.25",
    "תאריך יצירה": "2025-11-11 12:12:51",
    "מוצרים": [
      {
        "שם המוצר": "בגד גוף מעטפת",
        "מידות": [
          {
            "מידה": "0-3m",
            "כמות": 1,
            "הערה": "חולק ב-2 (Tubular)"
          }
        ]
      },
      {
        "שם המוצר": "גופיות סבא",
        "מידות": [
          {
            "מידה": "4",
            "כמות": 2,
            "הערה": "חולק ב-2 (Tubular)"
          },
          {
            "מידה": "5",
            "כמות": 1,
            "הערה": "חולק ב-2 (Tubular)"
          },
          {
            "מידה": "12",
            "כמות": 1,
            "הערה": "חולק ב-2 (Tubular)"
          }
        ]
      },
      {
        "שם המוצר": "רגליות",
        "מידות": [
          {
            "מידה": "0-3",
            "כמות": 2,
            "הערה": "רגיל"
          }
        ]
      }
    ],
    "סך כמויות": 7,
    "status": "נשלח",
    "סוג בד": "טריקו לבן",
    "נמען": "אריה",
    "נשלח לספק": true,
    "כמות שכבות משוערת": 200,
    "רוחב ציור": 85.0,
    "אורך ציור": 236.44079264813874
  },
  {
    "id": 27,
    "שם הקובץ": "for maged moly sets 16.11.25",
    "תאריך יצירה": "2025-11-16 09:53:51",
    "מוצרים": [
      {
        "שם המוצר": "בגד גוף מעטפת",
        "מידות": [
          {
            "מידה": "0-3m",
            "כמות": 2,
            "הערה": "חולק ב-2 (Tubular)"
          }
        ]
      },
      {
        "שם המוצר": "רגליות",
        "מידות": [
          {
            "מידה": "0-3",
            "כמות": 2,
            "הערה": "רגיל"
          }
        ]
      }
    ],
    "סך כמויות": 4,
    "status": "נשלח",
    "סוג בד": "פלנל מודפס",
    "נמען": "אלשראר מסחר ותעשייה בע\"מ",
    "נשלח לספק": true,
    "כמות שכבות משוערת": 200,
    "רוחב ציור": 82.0,
    "אורך ציור": 138.72367180104567
  },
  {
    "id": 28,
    "שם הקובץ": "for moshe 16.11.25",
    "תאריך יצירה": "2025-11-16 11:29:35",
    "מוצרים": [
      {
        "שם המוצר": "אוברול",
        "מידות": [
          {
            "מידה": "0-3",
            "כמות": 2,
            "הערה": "רגיל"
          },
          {
            "מידה": "3-6",
            "כמות": 1,
            "הערה": "רגיל"
          }
        ]
      }
    ],
    "סך כמויות": 3,
    "status": "נחתך",
    "סוג בד": "פלנל לבן",
    "נמען": "אריה",
    "נשלח לספק": true,
    "כמות שכבות משוערת": 200,
    "רוחב ציור": 90.0,
    "אורך ציור": 173.86047667787224,
    "שכבות": 176,
    "משקל כולל": 44.45,
    "מטרים כוללים": 119.13
  },
  {
    "id": 29,
    "שם הקובץ": "for moshe set pigama 18-24 83 cm",
    "תאריך יצירה": "2025-11-20 09:52:37",
    "מוצרים": [
      {
        "שם המוצר": "בגד גוף ש.א אמריקאי",
        "מידות": [
          {
            "מידה": "18m-24m",
            "כמות": 1,
            "הערה": "חולק ב-2 (Tubular)"
          }
        ]
      },
      {
        "שם המוצר": "גטקס",
        "מידות": [
          {
            "מידה": "18m-24m",
            "כמות": 1,
            "הערה": "חולק ב-2 (Tubular)"
          }
        ]
      }
    ],
    "סך כמויות": 2,
    "status": "נשלח",
    "סוג בד": "פלנל מודפס",
    "נמען": "אריה",
    "נשלח לספק": true,
    "כמות שכבות משוערת": 200,
    "רוחב ציור": 83.0,
    "אורך ציור": 98.83907993515238
  },
  {
    "id": 30,
    "שם הקובץ": "for maged red rib bodysuiye26",
    "תאריך יצירה": "2025-11-23 13:43:02",
    "מוצרים": [
      {
        "שם המוצר": "בגד גוף קצר כולל מידה6-9 9-12",
        "מידות": [
          {
            "מידה": "0-3",
            "כמות": 1,
            "הערה": "רגיל"
          },
          {
            "מידה": "3-6",
            "כמות": 1,
            "הערה": "רגיל"
          },
          {
            "מידה": "6-9",
            "כמות": 1,
            "הערה": "רגיל"
          },
          {
            "מידה": "9-12",
            "כמות": 1,
            "הערה": "רגיל"
          },
          {
            "מידה": "12-18",
            "כמות": 1,
            "הערה": "רגיל"
          },
          {
            "מידה": "18-24",
            "כמות": 1,
            "הערה": "רגיל"
          }
        ]
      }
    ],
    "סך כמויות": 6,
    "status": "נשלח",
    "סוג בד": "טריקו מודפס",
    "נמען": "אלשראר מסחר ותעשייה בע\"מ",
    "נשלח לספק": true,
    "כמות שכבות משוערת": 40,
    "רוחב ציור": 164.0,
    "אורך ציור": 112.09377974905641
  },
  {
    "id": 31,
    "שם הקובץ": "OVERALL 0-3_3-6_6-12 for moshe 79",
    "תאריך יצירה": "2025-11-24 10:36:27",
    "מוצרים": [
      {
        "שם המוצר": "אוברול",
        "מידות": [
          {
            "מידה": "0-3",
            "כמות": 1,
            "הערה": "רגיל"
          },
          {
            "מידה": "3-6",
            "כמות": 1,
            "הערה": "רגיל"
          },
          {
            "מידה": "6-12",
            "כמות": 1,
            "הערה": "רגיל"
          }
        ]
      }
    ],
    "סך כמויות": 3,
    "status": "נשלח",
    "סוג בד": "פלנל מודפס",
    "נמען": "אריה",
    "נשלח לספק": true,
    "כמות שכבות משוערת": 200,
    "רוחב ציור": 79.0,
    "אורך ציור": 214.8710980294286
  },
  {
    "id": 32,
    "שם הקובץ": "for maged 208 gufiya kids 3-8",
    "תאריך יצירה": "2025-11-26 13:19:42",
    "מוצרים": [
      {
        "שם המוצר": "גופיות סבא",
        "מידות": [
          {
            "מידה": "3",
            "כמות": 1,
            "הערה": "רגיל"
          },
          {
            "מידה": "4",
            "כמות": 3,
            "הערה": "רגיל"
          },
          {
            "מידה": "5",
            "כמות": 2,
            "הערה": "רגיל"
          },
          {
            "מידה": "6",
            "כמות": 3,
            "הערה": "רגיל"
          },
          {
            "מידה": "8",
            "כמות": 3,
            "הערה": "רגיל"
          },
          {
            "מידה": "10",
            "כמות": 3,
            "הערה": "רגיל"
          },
          {
            "מידה": "12",
            "כמות": 3,
            "הערה": "רגיל"
          },
          {
            "מידה": "14",
            "כמות": 1,
            "הערה": "רגיל"
          },
          {
            "מידה": "16",
            "כמות": 1,
            "הערה": "רגיל"
          }
        ]
      }
    ],
    "סך כמויות": 20,
    "status": "נשלח",
    "סוג בד": "טריקו לבן",
    "נמען": "אלשראר מסחר ותעשייה בע\"מ",
    "נשלח לספק": true,
    "כמות שכבות משוערת": 150,
    "רוחב ציור": 169.0,
    "אורך ציור": 427.39821782168576
  },
  {
    "id": 33,
    "שם הקובץ": "for maged 01.12.2025",
    "תאריך יצירה": "2025-12-01 10:31:46",
    "מוצרים": [
      {
        "שם המוצר": "בגד גוף מעטפת",
        "מידות": [
          {
            "מידה": "0-3m",
            "כמות": 4,
            "הערה": "חולק ב-2 (Tubular)"
          }
        ]
      },
      {
        "שם המוצר": "בגד גוף ש.א",
        "מידות": [
          {
            "מידה": "0-3",
            "כמות": 1,
            "הערה": "חולק ב-2 (Tubular)"
          },
          {
            "מידה": "3-6",
            "כמות": 2,
            "הערה": "חולק ב-2 (Tubular)"
          },
          {
            "מידה": "6-12",
            "כמות": 2,
            "הערה": "חולק ב-2 (Tubular)"
          },
          {
            "מידה": "12-18",
            "כמות": 4,
            "הערה": "חולק ב-2 (Tubular)"
          },
          {
            "מידה": "18-24",
            "כמות": 2,
            "הערה": "חולק ב-2 (Tubular)"
          }
        ]
      },
      {
        "שם המוצר": "רגליות",
        "מידות": [
          {
            "מידה": "0-3",
            "כמות": 4,
            "הערה": "רגיל"
          },
          {
            "מידה": "3-6",
            "כמות": 2,
            "הערה": "רגיל"
          },
          {
            "מידה": "6-12",
            "כמות": 2,
            "הערה": "רגיל"
          },
          {
            "מידה": "12-18",
            "כמות": 2,
            "הערה": "רגיל"
          }
        ]
      }
    ],
    "סך כמויות": 25,
    "status": "נחתך",
    "סוג בד": "פלנל לבן",
    "נמען": "אלשראר מסחר ותעשייה בע\"מ",
    "נשלח לספק": true,
    "כמות שכבות משוערת": 200,
    "רוחב ציור": 86.0,
    "אורך ציור": 844.5495823446079,
    "שכבות": 186,
    "משקל כולל": 330.95000000000005,
    "מטרים כוללים": 898.6899999999999
  },
  {
    "id": 34,
    "שם הקובץ": "for moshe rib with 6-9 and 9-12",
    "תאריך יצירה": "2025-12-01 11:15:18",
    "מוצרים": [
      {
        "שם המוצר": "בגד גוף קצר",
        "מידות": [
          {
            "מידה": "18-24",
            "כמות": 1,
            "הערה": "רגיל"
          }
        ]
      },
      {
        "שם המוצר": "בגד גוף קצר כולל מידה6-9 9-12",
        "מידות": [
          {
            "מידה": "6-9",
            "כמות": 1,
            "הערה": "רגיל"
          },
          {
            "מידה": "9-12",
            "כמות": 1,
            "הערה": "רגיל"
          }
        ]
      }
    ],
    "סך כמויות": 3,
    "status": "נשלח",
    "סוג בד": "פלנל לבן",
    "נמען": "אלשראר מסחר ותעשייה בע\"מ",
    "נשלח לספק": true,
    "כמות שכבות משוערת": 200,
    "רוחב ציור": 85.0,
    "אורך ציור": 117.7407721287546
  },
  {
    "id": 35,
    "שם הקובץ": "for maged bibi liis + bodysuite short",
    "תאריך יצירה": "2025-12-02 11:44:27",
    "מוצרים": [
      {
        "שם המוצר": "בגד גוף מעטפת",
        "מידות": [
          {
            "מידה": "0-3m",
            "כמות": 5,
            "הערה": "רגיל"
          }
        ]
      },
      {
        "שם המוצר": "בגד גוף קצר",
        "מידות": [
          {
            "מידה": "6-12",
            "כמות": 1,
            "הערה": "רגיל"
          },
          {
            "מידה": "12-18",
            "כמות": 1,
            "הערה": "רגיל"
          },
          {
            "מידה": "18-24",
            "כמות": 1,
            "הערה": "רגיל"
          }
        ]
      },
      {
        "שם המוצר": "רגליות",
        "מידות": [
          {
            "מידה": "0-3",
            "כמות": 5,
            "הערה": "רגיל"
          }
        ]
      }
    ],
    "סך כמויות": 13,
    "status": "נשלח",
    "סוג בד": "טריקו לבן",
    "נמען": "אלשראר מסחר ותעשייה בע\"מ",
    "נשלח לספק": true,
    "כמות שכבות משוערת": 200,
    "רוחב ציור": 169.0,
    "אורך ציור": 293.42189025878906
  },
  {
    "id": 36,
    "שם הקובץ": "for moshe rib black 99 cm",
    "תאריך יצירה": "2025-12-03 10:24:00",
    "מוצרים": [
      {
        "שם המוצר": "בגד גוף מעטפת",
        "מידות": [
          {
            "מידה": "0-3m",
            "כמות": 2,
            "הערה": "רגיל"
          }
        ]
      },
      {
        "שם המוצר": "רגליות",
        "מידות": [
          {
            "מידה": "0-3",
            "כמות": 1,
            "הערה": "רגיל"
          }
        ]
      }
    ],
    "סך כמויות": 3,
    "status": "נשלח",
    "סוג בד": "פלנל מודפס",
    "נמען": "אריה",
    "נשלח לספק": true,
    "כמות שכבות משוערת": 200,
    "רוחב ציור": 99.0,
    "אורך ציור": 111.71520649693345
  },
  {
    "id": 37,
    "שם הקובץ": "for moshe intrlouk 79 cm",
    "תאריך יצירה": "2025-12-03 13:28:40",
    "מוצרים": [
      {
        "שם המוצר": "בגד גוף מעטפת",
        "מידות": [
          {
            "מידה": "0-3m",
            "כמות": 2,
            "הערה": "רגיל"
          }
        ]
      },
      {
        "שם המוצר": "רגליות",
        "מידות": [
          {
            "מידה": "0-3",
            "כמות": 1,
            "הערה": "רגיל"
          }
        ]
      }
    ],
    "סך כמויות": 3,
    "status": "נשלח",
    "סוג בד": "פלנל מודפס",
    "נמען": "אריה",
    "נשלח לספק": true,
    "כמות שכבות משוערת": 200,
    "רוחב ציור": 79.0,
    "אורך ציור": 143.33199084153387
  },
  {
    "id": 38,
    "שם הקובץ": "for moshe 04.12.25 83 interlouck",
    "תאריך יצירה": "2025-12-04 13:18:06",
    "מוצרים": [
      {
        "שם המוצר": "בגד גוף מעטפת",
        "מידות": [
          {
            "מידה": "0-3m",
            "כמות": 2,
            "הערה": "רגיל"
          }
        ]
      },
      {
        "שם המוצר": "רגליות",
        "מידות": [
          {
            "מידה": "0-3",
            "כמות": 1,
            "הערה": "רגיל"
          }
        ]
      }
    ],
    "סך כמויות": 3,
    "status": "נשלח",
    "סוג בד": "פלנל מודפס",
    "נמען": "אריה",
    "נשלח לספק": true,
    "כמות שכבות משוערת": 200,
    "רוחב ציור": 83.0,
    "אורך ציור": 134.1370665260261
  },
  {
    "id": 39,
    "שם הקובץ": "for maged moly pink 169",
    "תאריך יצירה": "2025-12-07 10:55:14",
    "מוצרים": [
      {
        "שם המוצר": "בגד גוף מעטפת",
        "מידות": [
          {
            "מידה": "0-3m",
            "כמות": 2,
            "הערה": "רגיל"
          }
        ]
      },
      {
        "שם המוצר": "רגליות",
        "מידות": [
          {
            "מידה": "0-3",
            "כמות": 1,
            "הערה": "רגיל"
          }
        ]
      }
    ],
    "סך כמויות": 3,
    "status": "נשלח",
    "סוג בד": "טריקו מודפס",
    "נמען": "אלשראר מסחר ותעשייה בע\"מ",
    "נשלח לספק": true,
    "כמות שכבות משוערת": 200,
    "רוחב ציור": 169.0,
    "אורך ציור": 66.70728619925717
  },
  {
    "id": 40,
    "שם הקובץ": "for moshe 89 cm interlouck",
    "תאריך יצירה": "2025-12-09 11:42:47",
    "מוצרים": [
      {
        "שם המוצר": "גופיות פלנל",
        "מידות": [
          {
            "מידה": "4",
            "כמות": 1,
            "הערה": "חולק ב-2 (Tubular)"
          },
          {
            "מידה": "6",
            "כמות": 1,
            "הערה": "חולק ב-2 (Tubular)"
          }
        ]
      },
      {
        "שם המוצר": "חולצת בייבי",
        "מידות": [
          {
            "מידה": "18m-24m",
            "כמות": 1,
            "הערה": "חולק ב-2 (Tubular)"
          }
        ]
      },
      {
        "שם המוצר": "חזיות טיק טק",
        "מידות": [
          {
            "מידה": "0-3m",
            "כמות": 1,
            "הערה": "חולק ב-2 (Tubular)"
          }
        ]
      }
    ],
    "סך כמויות": 4,
    "status": "נשלח",
    "סוג בד": "פלנל לבן",
    "נמען": "אריה",
    "נשלח לספק": true,
    "כמות שכבות משוערת": 200,
    "רוחב ציור": 89.0,
    "אורך ציור": 205.44803676949917
  },
  {
    "id": 41,
    "שם הקובץ": "for moshe 15.12.25 89 cm",
    "תאריך יצירה": "2025-12-15 08:37:20",
    "מוצרים": [
      {
        "שם המוצר": "אוברול",
        "מידות": [
          {
            "מידה": "6-12",
            "כמות": 1.0,
            "הערה": "חולק ב-2 (Tubular)"
          }
        ]
      },
      {
        "שם המוצר": "גטקס",
        "מידות": [
          {
            "מידה": "3-6",
            "כמות": 0.5,
            "הערה": "חולק ב-2 (Tubular)"
          },
          {
            "מידה": "4",
            "כמות": 1.0,
            "הערה": "חולק ב-2 (Tubular)"
          },
          {
            "מידה": "6",
            "כמות": 0.5,
            "הערה": "חולק ב-2 (Tubular)"
          }
        ]
      }
    ],
    "סך כמויות": 3.0,
    "status": "נשלח",
    "סוג בד": "פלנל לבן",
    "נמען": "אריה",
    "נשלח לספק": true,
    "כמות שכבות משוערת": 200,
    "רוחב ציור": 89.0,
    "אורך ציור": 165.65619024642706
  },
  {
    "id": 42,
    "שם הקובץ": "for maged unterlouck 15.12.25",
    "תאריך יצירה": "2025-12-15 15:18:14",
    "מוצרים": [
      {
        "שם המוצר": "בגד גוף מעטפת",
        "מידות": [
          {
            "מידה": "0-3m",
            "כמות": 2,
            "הערה": "חולק ב-2 (Tubular)"
          }
        ]
      },
      {
        "שם המוצר": "רגליות",
        "מידות": [
          {
            "מידה": "0-3",
            "כמות": 2,
            "הערה": "רגיל"
          }
        ]
      }
    ],
    "סך כמויות": 4,
    "status": "נחתך",
    "סוג בד": "טריקו לבן",
    "נמען": "אלשראר מסחר ותעשייה בע\"מ",
    "נשלח לספק": true,
    "כמות שכבות משוערת": 200,
    "רוחב ציור": 84.0,
    "אורך ציור": 131.88251712118296,
    "שכבות": 134,
    "משקל כולל": 29.200000000000003,
    "מטרים כוללים": 95.42
  },
  {
    "id": 43,
    "שם הקובץ": "for maged 22.12.2025 interlouck",
    "תאריך יצירה": "2025-12-22 10:45:55",
    "מוצרים": [
      {
        "שם המוצר": "בגד גוף ש.א",
        "מידות": [
          {
            "מידה": "3-6",
            "כמות": 2,
            "הערה": "חולק ב-2 (Tubular)"
          },
          {
            "מידה": "12-18",
            "כמות": 3,
            "הערה": "חולק ב-2 (Tubular)"
          },
          {
            "מידה": "18-24",
            "כמות": 3,
            "הערה": "חולק ב-2 (Tubular)"
          },
          {
            "מידה": "24-30",
            "כמות": 4,
            "הערה": "חולק ב-2 (Tubular)"
          }
        ]
      }
    ],
    "סך כמויות": 12,
    "status": "נשלח",
    "סוג בד": "פלנל לבן",
    "נמען": "אלשראר מסחר ותעשייה בע\"מ",
    "נשלח לספק": true,
    "כמות שכבות משוערת": 200,
    "רוחב ציור": 86.0,
    "אורך ציור": 609.3431015802496
  },
  {
    "id": 45,
    "שם הקובץ": "for maged print rib 28.12.25",
    "תאריך יצירה": "2025-12-28 11:24:52",
    "מוצרים": [
      {
        "שם המוצר": "אוברול",
        "מידות": [
          {
            "מידה": "0-3",
            "כמות": 2,
            "הערה": "רגיל"
          }
        ]
      },
      {
        "שם המוצר": "בגד גוף מעטפת",
        "מידות": [
          {
            "מידה": "0-3m",
            "כמות": 2,
            "הערה": "רגיל"
          }
        ]
      },
      {
        "שם המוצר": "רגליות",
        "מידות": [
          {
            "מידה": "0-3",
            "כמות": 2,
            "הערה": "כפול 2"
          }
        ]
      }
    ],
    "סך כמויות": 6,
    "status": "נשלח",
    "סוג בד": "טריקו מודפס",
    "נמען": "אלשראר מסחר ותעשייה בע\"מ",
    "נשלח לספק": true,
    "כמות שכבות משוערת": 200,
    "רוחב ציור": 169.0,
    "אורך ציור": 122.67262435262664
  },
  {
    "id": 46,
    "שם הקובץ": "rib 01.01.26",
    "תאריך יצירה": "2026-01-01 14:18:47",
    "מוצרים": [
      {
        "שם המוצר": "בגד גוף ש.א",
        "מידות": [
          {
            "מידה": "3-6",
            "כמות": 1,
            "הערה": "חולק ב-2 (Tubular)"
          },
          {
            "מידה": "6-12",
            "כמות": 1,
            "הערה": "חולק ב-2 (Tubular)"
          },
          {
            "מידה": "12-18",
            "כמות": 1,
            "הערה": "חולק ב-2 (Tubular)"
          },
          {
            "מידה": "18-24",
            "כמות": 1,
            "הערה": "חולק ב-2 (Tubular)"
          },
          {
            "מידה": "24-30",
            "כמות": 1,
            "הערה": "חולק ב-2 (Tubular)"
          }
        ]
      }
    ],
    "סך כמויות": 5,
    "status": "נשלח",
    "סוג בד": "טריקו לבן",
    "נמען": "אריה",
    "נשלח לספק": true,
    "כמות שכבות משוערת": 200,
    "רוחב ציור": 85.0,
    "אורך ציור": 240.25713348388672
  }
]